{
  "process_id": "storage_composting_nc_vs",
  "name": "Manure storage, composting (static pile), NC, per kg VS in. CO2 and VS out not estimated (gap: no open aerobic carbon-loss factor read).",
  "region_id": "NC",
  "reference": {
    "flow_id": "manure_volatile_solids_in",
    "amount": {
      "value": 1,
      "unit_id": "kg",
      "basis": "absolute",
      "source_id": "stoichiometry",
      "quality_id": "q_derived",
      "origin": "entered"
    }
  },
  "exchanges": [
    {
      "flow_id": "methane_biogenic_air",
      "direction": "output",
      "amount": {
        "value": 0.001608,
        "unit_id": "kg",
        "basis": "absolute",
        "source_id": "epa_2009_manure_tsd",
        "quality_id": "q_storage_ipcc2006",
        "origin": "derived",
        "note": "VS x B0 x MCF (0.005) x 0.67; sources: epa_2009_manure_tsd, epa_ghgi_2017_annex3_11, stoichiometry"
      },
      "estimation_method": {
        "method": "IPCC 2006/2019 Vol.4 Ch.10 Eq.10.23",
        "ipcc_tier": 2
      }
    }
  ],
  "system_layer": "foreground"
}
