{
  "process_id": "storage_anaerobic_digester_ia_vs",
  "name": "Manure storage, anaerobic digester (enclosed), IA, per kg VS in; biogas flared or burned for energy",
  "region_id": "IA",
  "reference": {
    "flow_id": "manure_volatile_solids_in",
    "amount": {
      "value": 1,
      "unit_id": "kg",
      "basis": "absolute",
      "source_id": "stoichiometry",
      "quality_id": "q_derived",
      "origin": "entered"
    }
  },
  "exchanges": [
    {
      "flow_id": "methane_biogenic_air",
      "direction": "output",
      "amount": {
        "value": 0.007582,
        "unit_id": "kg",
        "basis": "absolute",
        "source_id": "epa_2009_manure_tsd",
        "quality_id": "q_storage_ipcc2006",
        "origin": "derived",
        "note": "leakage 0.028 of produced + combustion slip 0.01 of burned; sources: epa_2009_manure_tsd, expert_mahmoud_2026, unfccc_cdm_tool14_2024"
      },
      "estimation_method": {
        "method": "UNFCCC CDM TOOL14 leakage; EPA destruction efficiency"
      }
    },
    {
      "flow_id": "carbon_dioxide_biogenic_air",
      "direction": "output",
      "amount": {
        "value": 0.9004,
        "unit_id": "kg",
        "basis": "absolute",
        "source_id": "unfccc_cdm_tool14_2024",
        "quality_id": "q_storage_ipcc2006",
        "origin": "derived",
        "note": "biogas CO2 + CO2 from burned CH4; sources: epa_2009_manure_tsd, expert_mahmoud_2026, unfccc_cdm_tool14_2024"
      }
    },
    {
      "flow_id": "biogas_methane_recovered",
      "direction": "output",
      "amount": {
        "value": 0.195372,
        "unit_id": "kg",
        "basis": "absolute",
        "source_id": "epa_2009_manure_tsd",
        "quality_id": "q_storage_ipcc2006",
        "origin": "derived",
        "note": "CH4 delivered to flare or engine; reported, not allocated (v1); sources: epa_2009_manure_tsd, expert_mahmoud_2026, unfccc_cdm_tool14_2024"
      }
    },
    {
      "flow_id": "manure_volatile_solids_out",
      "direction": "output",
      "amount": {
        "value": 0.375,
        "unit_id": "kg",
        "basis": "absolute",
        "source_id": "expert_mahmoud_2026",
        "quality_id": "q_storage_expert",
        "origin": "derived",
        "note": "1 - VS destroyed"
      }
    }
  ],
  "system_layer": "foreground"
}
