{
  "process_id": "infrastructure_shallow_pit",
  "name": "Shallow pit, concrete; per m3 of capacity per year",
  "region_id": "US",
  "reference": {
    "flow_id": "storage_capacity_year",
    "amount": {
      "value": 1,
      "unit_id": "m3_year",
      "basis": "absolute",
      "source_id": "stoichiometry",
      "quality_id": "q_derived",
      "origin": "entered"
    }
  },
  "exchanges": [
    {
      "flow_id": "concrete_ready_mix",
      "direction": "input",
      "amount": {
        "value": 0.017667,
        "unit_id": "m3",
        "basis": "absolute",
        "source_id": "nrcs_practice_lifespan",
        "quality_id": "q_storage_design",
        "origin": "derived",
        "note": "walls, floor, footing; spread over 15 yr; sources: assumed_storage, nrcs_practice_lifespan"
      }
    },
    {
      "flow_id": "reinforcing_steel",
      "direction": "input",
      "amount": {
        "value": 0.54,
        "unit_id": "kg",
        "basis": "absolute",
        "source_id": "nrcs_practice_lifespan",
        "quality_id": "q_storage_design",
        "origin": "derived",
        "note": "spread over 15 yr; sources: assumed_storage, nrcs_practice_lifespan"
      }
    }
  ],
  "system_layer": "direct_supply"
}
