{
  "process_id": "storage_anaerobic_lagoon_nc_n",
  "name": "Manure storage, anaerobic lagoon (single or multi-stage), NC, per kg N in",
  "region_id": "NC",
  "reference": {
    "flow_id": "manure_nitrogen_in",
    "amount": {
      "value": 1,
      "unit_id": "kg",
      "basis": "absolute",
      "source_id": "stoichiometry",
      "quality_id": "q_derived",
      "origin": "entered"
    }
  },
  "exchanges": [
    {
      "flow_id": "dinitrogen_monoxide_air",
      "direction": "output",
      "amount": {
        "value": 0.0,
        "unit_id": "kg",
        "basis": "absolute",
        "source_id": "epa_2009_manure_tsd",
        "quality_id": "q_storage_ipcc2006",
        "origin": "derived",
        "note": "direct: EF3 0.0 x 44/28"
      },
      "estimation_method": {
        "method": "IPCC Vol.4 Ch.10 Eq.10.25",
        "ipcc_tier": 2
      }
    },
    {
      "flow_id": "ammonia_air",
      "direction": "output",
      "amount": {
        "value": 0.485714,
        "unit_id": "kg",
        "basis": "absolute",
        "source_id": "mpi_nz_2025_ipcc2019",
        "quality_id": "q_storage_secondary",
        "origin": "derived",
        "note": "Frac_GasMS 0.4 counted as all NH3, x 17/14"
      },
      "estimation_method": {
        "method": "IPCC Vol.4 Ch.10 Eq.10.26",
        "ipcc_tier": 2
      }
    },
    {
      "flow_id": "dinitrogen_monoxide_air",
      "direction": "output",
      "amount": {
        "value": 0.006286,
        "unit_id": "kg",
        "basis": "absolute",
        "source_id": "mpi_nz_2025_ipcc2019",
        "quality_id": "q_storage_secondary",
        "origin": "derived",
        "note": "indirect: (Frac_GasMS x EF4 + Frac_LeachMS x EF5) x 44/28; sources: ipcc_2019_v4_ch11, mpi_nz_2025_ipcc2019, nrcs_cps521_2023"
      },
      "estimation_method": {
        "method": "IPCC Vol.4 Ch.10 Eq.10.28-10.29",
        "ipcc_tier": 2
      }
    },
    {
      "flow_id": "nitrogen_leached_water",
      "direction": "output",
      "amount": {
        "value": 0.0,
        "unit_id": "kg",
        "basis": "absolute",
        "source_id": "nrcs_cps521_2023",
        "quality_id": "q_storage_secondary",
        "origin": "derived",
        "note": "lined or contained storage"
      }
    },
    {
      "flow_id": "nitrogen_unaccounted",
      "direction": "output",
      "amount": {
        "value": 0.35,
        "unit_id": "kg",
        "basis": "absolute",
        "source_id": "nrcs_awmfh_ch11_2013",
        "quality_id": "q_storage_awmfh",
        "origin": "derived",
        "note": "1 - retained (AWMFH 20-30%) - NH3-N - N2O-N; mostly N2 (denitrification); sources: epa_2009_manure_tsd, mpi_nz_2025_ipcc2019, nrcs_awmfh_ch11_2013"
      },
      "estimation_method": {
        "method": "mass balance closure"
      }
    },
    {
      "flow_id": "manure_nitrogen_to_sludge",
      "direction": "output",
      "amount": {
        "value": 0.093167,
        "unit_id": "kg",
        "basis": "absolute",
        "source_id": "nrcs_awmfh_ch4_2008",
        "quality_id": "q_storage_awmfh",
        "origin": "derived",
        "note": "sludge N:P 1.04 x P to sludge x P/N excreted (0.156); sources: nrcs_awmfh_ch11_2013, nrcs_awmfh_ch4_2008"
      }
    },
    {
      "flow_id": "manure_nitrogen_to_effluent",
      "direction": "output",
      "amount": {
        "value": 0.156833,
        "unit_id": "kg",
        "basis": "absolute",
        "source_id": "nrcs_awmfh_ch11_2013",
        "quality_id": "q_storage_awmfh",
        "origin": "derived",
        "note": "retained N minus sludge N; sources: nrcs_awmfh_ch11_2013, nrcs_awmfh_ch4_2008"
      }
    }
  ],
  "system_layer": "foreground"
}
